### ISSUE TITLE
[Bug] 

### ISSUE THREAD

**Issue by fate96** [Dreamacro/clash#1990]
### Verify steps

- [X]  如果你可以自己 debug 并解决的话，提交 PR 吧 Is this something you can **debug and fix**? Send a pull request! Bug fixes and documentation fixes are welcome. 
- [X]  我已经在 [Issue Tracker](……/) 中找过我要提出的问题 I have searched on the [issue tracker](……/) for a related issue. 
- [X]  我已经使用 dev 分支版本测试过，问题依旧存在 I have tested using the dev branch, and the issue still exists. 
- [X]  我已经仔细看过 [Documentation](https://github.com/Dreamacro/clash/wiki/) 并无法自行解决问题 I have read the [documentation](https://github.com/Dreamacro/clash/wiki/) and was unable to solve the issue. 
- [X]  这是 Clash 核心的问题，并非我所使用的 Clash 衍生版本（如 OpenClash、KoolClash 等）的特定问题 This is an issue of the Clash core *per se*, not to the derivatives of Clash, like OpenClash or KoolClash. 

### Clash version

fake-ip DNS异常

### What OS are you seeing the problem on?

Linux

### Clash config

```yaml
mixed-port: 7890
allow-lan: true
mode: Rule
log-level: info
external-controller: 127.0.0.1:9090
socks-port: 7891
redir-port: 7892
tproxy-port: 7893
ipv6: false
external-ui: '/usr/share/yacd'
profile:
  # Store the `select` results in $HOME/.config/clash/.cache
  # set false If you don't want this behavior
  # when two different configurations have groups with the same name, the selected values are shared
  store-selected: false
  # persistence fakeip
  store-fake-ip: true
dns:
  enable: true
  listen: 0.0.0.0:1053
  enhanced-mode: fake-ip
  fake-ip-range: 198.18.0.1/16
  nameserver:
    - https://223.5.5.5/dns-query
    - https://doh.pub/dns-query
    #- 114.114.114.114
    #- 223.5.5.5
  fallback:
    - https://1.1.1.1/dns-query
    - https://1.0.0.1/dns-query
    - https://8.8.8.8/dns-query
  fallback-filter:
    geoip: true                  # default
    geoip-code: CN
  fake-ip-filter:
    - '*.lan'
    - '*.localhost'
    - '*.local'
    - 'lens.l.google.com'
    - 'stun.l.google.com'
```

### Clash log

```shell
22-02-24 10:49:49
debug
[Metadata PreHandle] error: fake DNS record 198.18.0.138 missing
22-02-24 10:49:49
debug
[Metadata PreHandle] error: fake DNS record 198.18.0.138 missing
22-02-24 10:49:49
debug
[Metadata PreHandle] error: fake DNS record 198.18.0.138 missing
22-02-24 10:49:49
debug
[Metadata PreHandle] error: fake DNS record 198.18.0.138 missing
22-02-24 10:49:49
debug
[Metadata PreHandle] error: fake DNS record 198.18.0.133 missing
22-02-24 10:49:49
debug
[Metadata PreHandle] error: fake DNS record 198.18.0.133 missing
22-02-24 10:49:49
debug
[Metadata PreHandle] error: fake DNS record 198.18.0.133 missing
22-02-24 10:49:49
debug
[Metadata PreHandle] error: fake DNS record 198.18.0.133 missing
22-02-24 10:49:49
debug
[Metadata PreHandle] error: fake DNS record 198.18.0.133 missing
```

##  后续测试：使用clash-user，config更换为redir-host，dns解析正常。更换为社区Community版本（clash内核版本为1.8），使用redir-host或fake-ip），都运行正常。以下是运行异常的iptable规则和log

iptables 规则：
#tcp
iptables -t nat -N clash
iptables -t nat -A clash -d 0.0.0.0/8 -j RETURN
iptables -t nat -A clash -d 10.0.0.0/8 -j RETURN
iptables -t nat -A clash -d 127.0.0.0/8 -j RETURN
iptables -t nat -A clash -d 169.254.0.0/16 -j RETURN
iptables -t nat -A clash -d 172.16.0.0/12 -j RETURN
iptables -t nat -A clash -d 192.168.0.0/16 -j RETURN
iptables -t nat -A clash -d 224.0.0.0/4 -j RETURN
iptables -t nat -A clash -d 240.0.0.0/4 -j RETURN
iptables -t nat -A clash -p tcp -j REDIRECT --to-port 7892
iptables -t nat -I PREROUTING -p tcp -d 8.8.8.8 -j REDIRECT --to-port 7892
iptables -t nat -I PREROUTING -p tcp -d 8.8.4.4 -j REDIRECT --to-port 7892
iptables -t nat -A PREROUTING -p tcp -j clash
iptables -t nat -A OUTPUT -p tcp -d 198.18.0.0/16 -j REDIRECT --to-port 7892

#udp
ip rule add fwmark 1 table 100
ip route add local default dev lo table 100
iptables -t mangle -N clash
iptables -t mangle -A clash -d 0.0.0.0/8 -j RETURN
iptables -t mangle -A clash -d 10.0.0.0/8 -j RETURN
iptables -t mangle -A clash -d 127.0.0.0/8 -j RETURN
iptables -t mangle -A clash -d 169.254.0.0/16 -j RETURN
iptables -t mangle -A clash -d 172.16.0.0/12 -j RETURN
iptables -t mangle -A clash -d 192.168.0.0/16 -j RETURN
iptables -t mangle -A clash -d 224.0.0.0/4 -j RETURN
iptables -t mangle -A clash -d 240.0.0.0/4 -j RETURN
iptables -t mangle -A clash -p udp -j TPROXY --on-port 7893 --tproxy-mark 1
iptables -t mangle -A OUTPUT -p udp -d 198.18.0.0/16 -j MARK --set-mark 1
iptables -t mangle -A PREROUTING -p udp -j clash
iptables -t nat -N CLASH_DNS
iptables -t nat -F CLASH_DNS
iptables -t nat -A CLASH_DNS -p udp -j REDIRECT --to-port 1053
iptables -t nat -I OUTPUT -p udp --dport 53 -j CLASH_DNS
iptables -t nat -I PREROUTING -p udp --dport 53 -j REDIRECT --to 1053

iptables -t mangle -A OUTPUT -m owner --uid-owner clash -j RETURN

TCP 错误连接信息
1	10:57:06.161847842	192.168.68.1	224.0.0.1	IGMPv2	46	Membership Query, general
2	10:57:06.241203329	192.168.68.1	224.0.0.1	IGMPv2	46	Membership Query, general
3	10:57:06.360253636	192.168.68.1	224.0.0.1	IGMPv2	46	Membership Query, general
4	10:57:06.984525559	120.232.193.96	192.168.68.190	TCP	66	65521 → 34410 [ACK] Seq=1 Ack=1 Win=245 Len=0 TSval=3126357849 TSecr=1998628219
5	10:57:06.984589462	192.168.68.190	120.232.193.96	TCP	66	[TCP ACKed unseen segment] 34410 → 65521 [ACK] Seq=1 Ack=2 Win=501 Len=0 TSval=1998638670 TSecr=3126327220
6	10:57:07.059877042	192.168.68.1	224.0.0.22	IGMPv2	46	Membership Report group 224.0.0.22
7	10:57:07.266698781	192.168.68.1	224.0.0.22	IGMPv2	46	Membership Report group 224.0.0.22
8	10:57:07.733366903	192.168.68.190	120.232.193.98	TCP	66	34400 → 7591 [ACK] Seq=1 Ack=1 Win=501 Len=0 TSval=2660214754 TSecr=697910244
9	10:57:07.733389322	192.168.68.190	120.232.193.96	TCP	66	[TCP Keep-Alive] [TCP ACKed unseen segment] 34410 → 65521 [ACK] Seq=0 Ack=2 Win=501 Len=0 TSval=1998639419 TSecr=3126327220
10	10:57:07.779605184	120.232.193.97	192.168.68.190	TCP	66	7591 → 58260 [ACK] Seq=1 Ack=1 Win=245 Len=0 TSval=1297360184 TSecr=663118900
11	10:57:07.779635145	192.168.68.190	120.232.193.97	TCP	66	[TCP ACKed unseen segment] 58260 → 7591 [ACK] Seq=1 Ack=2 Win=501 Len=0 TSval=663129059 TSecr=1297350087
12	10:57:07.794929224	120.232.193.96	192.168.68.190	TCP	66	[TCP Previous segment not captured] 65521 → 34410 [ACK] Seq=2 Ack=1 Win=245 Len=0 TSval=3126358897 TSecr=1998638670
13	10:57:07.803303613	120.232.193.98	192.168.68.190	TCP	66	[TCP ACKed unseen segment] 7591 → 34400 [ACK] Seq=1 Ack=2 Win=245 Len=0 TSval=697940686 TSecr=2660205072
14	10:57:08.283172496	120.232.193.98	192.168.68.190	TCP	66	[TCP Keep-Alive] [TCP ACKed unseen segment] 7591 → 34400 [ACK] Seq=0 Ack=2 Win=245 Len=0 TSval=697941170 TSecr=2660205072
15	10:57:08.283215377	192.168.68.190	120.232.193.98	TCP	66	[TCP Previous segment not captured] 34400 → 7591 [ACK] Seq=2 Ack=1 Win=501 Len=0 TSval=2660215303 TSecr=697940686

dokcer 错误连接信息
1	08:45:07.729719540	172.19.0.2	172.19.0.1	DNS	79	Standard query 0xd1d4 AAAA mirror.pkgbuild.com
2	08:45:07.729719540	172.19.0.2	172.19.0.1	DNS	79	Standard query 0x6647 A mirror.pkgbuild.com
3	08:45:07.729719540	172.19.0.2	172.19.0.1	DNS	79	Standard query 0x56c9 A mirror.pkgbuild.com
4	08:45:07.729719540	172.19.0.2	172.19.0.1	DNS	79	Standard query 0x5ed7 A mirror.pkgbuild.com
5	08:45:07.729731830	172.19.0.2	172.19.0.1	DNS	79	Standard query 0x955f AAAA mirror.pkgbuild.com
6	08:45:07.729776243	172.19.0.2	172.19.0.1	DNS	79	Standard query 0x96c0 AAAA mirror.pkgbuild.com
7	08:45:07.729978753	8.8.8.8	172.19.0.2	DNS	79	Standard query response 0x96c0 AAAA mirror.pkgbuild.com
8	08:45:07.730012062	8.8.8.8	172.19.0.2	DNS	95	Standard query response 0x6647 A mirror.pkgbuild.com A 198.18.0.185
9	08:45:07.730031196	8.8.8.8	172.19.0.2	DNS	95	Standard query response 0x56c9 A mirror.pkgbuild.com A 198.18.0.184
10	08:45:07.730044953	8.8.8.8	172.19.0.2	DNS	95	Standard query response 0x5ed7 A mirror.pkgbuild.com A 198.18.0.183
11	08:45:07.730054939	8.8.8.8	172.19.0.2	DNS	79	Standard query response 0xd1d4 AAAA mirror.pkgbuild.com
12	08:45:07.730065064	8.8.8.8	172.19.0.2	DNS	79	Standard query response 0x955f AAAA mirror.pkgbuild.com
13	08:45:07.730202143	172.19.0.2	172.19.0.1	TCP	74	47998 → 7892 [SYN] Seq=0 Win=64240 Len=0 MSS=1460 SACK_PERM=1 TSval=788495658 TSecr=0 WS=128
14	08:45:07.730235801	198.18.0.184	172.19.0.2	TCP	74	443 → 47998 [SYN, ACK] Seq=0 Ack=1 Win=65160 Len=0 MSS=1460 SACK_PERM=1 TSval=2168478953 TSecr=788495658 WS=128
15	08:45:07.730259264	172.19.0.2	172.19.0.1	TCP	66	47998 → 7892 [ACK] Seq=1 Ack=1 Win=64256 Len=0 TSval=788495658 TSecr=2168478953
16	08:45:07.730402627	198.18.0.184	172.19.0.2	TCP	66	443 → 47998 [FIN, ACK] Seq=1 Ack=1 Win=65280 Len=0 TSval=2168478953 TSecr=788495658
17	08:45:07.731657910	172.19.0.2	172.19.0.1	TCP	66	47998 → 7892 [ACK] Seq=1 Ack=2 Win=64256 Len=0 TSval=788495660 TSecr=2168478953
18	08:45:07.734073017	172.19.0.2	172.19.0.1	TLSv1	583	Client Hello
19	08:45:07.734083003	198.18.0.184	172.19.0.2	TCP	54	443 → 47998 [RST] Seq=2 Win=0 Len=0
20	08:45:07.734325177	172.19.0.2	172.19.0.1	TCP	74	48000 → 7892 [SYN] Seq=0 Win=64240 Len=0 MSS=1460 SACK_PERM=1 TSval=788495662 TSecr=0 WS=128
21	08:45:07.734336978	198.18.0.184	172.19.0.2	TCP	74	443 → 48000 [SYN, ACK] Seq=0 Ack=1 Win=65160 Len=0 MSS=1460 SACK_PERM=1 TSval=2168478957 TSecr=788495662 WS=128
22	08:45:07.734345567	172.19.0.2	172.19.0.1	TCP	66	48000 → 7892 [ACK] Seq=1 Ack=1 Win=64256 Len=0 TSval=788495662 TSecr=2168478957
23	08:45:07.734425035	198.18.0.184	172.19.0.2	TCP	66	443 → 48000 [FIN, ACK] Seq=1 Ack=1 Win=65280 Len=0 TSval=2168478957 TSecr=788495662
24	08:45:07.734987175	172.19.0.2	172.19.0.1	TCP	66	48000 → 7892 [ACK] Seq=1 Ack=2 Win=64256 Len=0 TSval=788495663 TSecr=2168478957
25	08:45:07.737345299	172.19.0.2	172.19.0.1	TLSv1	583	Client Hello
26	08:45:07.737354308	198.18.0.184	172.19.0.2	TCP	54	443 → 48000 [RST] Seq=2 Win=0 Len=0
27	08:45:07.737588381	172.19.0.2	172.19.0.1	TCP	74	48002 → 7892 [SYN] Seq=0 Win=64240 Len=0 MSS=1460 SACK_PERM=1 TSval=788495666 TSecr=0 WS=128
28	08:45:07.737599554	198.18.0.184	172.19.0.2	TCP	74	443 → 48002 [SYN, ACK] Seq=0 Ack=1 Win=65160 Len=0 MSS=1460 SACK_PERM=1 TSval=2168478961 TSecr=788495666 WS=128
29	08:45:07.737608562	172.19.0.2	172.19.0.1	TCP	66	48002 → 7892 [ACK] Seq=1 Ack=1 Win=64256 Len=0 TSval=788495666 TSecr=2168478961
30	08:45:07.737676787	198.18.0.184	172.19.0.2	TCP	66	443 → 48002 [FIN, ACK] Seq=1 Ack=1 Win=65280 Len=0 TSval=2168478961 TSecr=788495666
31	08:45:07.738313507	172.19.0.2	172.19.0.1	TCP	66	48002 → 7892 [ACK] Seq=1 Ack=2 Win=64256 Len=0 TSval=788495666 TSecr=2168478961
32	08:45:07.740792858	172.19.0.2	172.19.0.1	TLSv1	583	Client Hello
33	08:45:07.740803263	198.18.0.184	172.19.0.2	TCP	54	443 → 48002 [RST] Seq=2 Win=0 Len=0
