### ISSUE TITLE
[Bug] fake-ip 模式下没有返回 fake-ip

### ISSUE THREAD

**Issue by moonheart** [Dreamacro/clash#2083]
### Verify steps

- [X]  如果你可以自己 debug 并解决的话，提交 PR 吧 Is this something you can **debug and fix**? Send a pull request! Bug fixes and documentation fixes are welcome. 
- [X]  我已经在 [Issue Tracker](……/) 中找过我要提出的问题 I have searched on the [issue tracker](……/) for a related issue. 
- [X]  我已经使用 dev 分支版本测试过，问题依旧存在 I have tested using the dev branch, and the issue still exists. 
- [X]  我已经仔细看过 [Documentation](https://github.com/Dreamacro/clash/wiki/) 并无法自行解决问题 I have read the [documentation](https://github.com/Dreamacro/clash/wiki/) and was unable to solve the issue. 
- [X]  这是 Clash 核心的问题，并非我所使用的 Clash 衍生版本（如 OpenClash、KoolClash 等）的特定问题 This is an issue of the Clash core *per se*, not to the derivatives of Clash, like OpenClash or KoolClash. 

### Clash version

Clash latest linux amd64 with go1.18.1 Sat 16 Apr 2022 07:56:37 AM UTC

### Clash config

```yaml
mixed-port: 7890
allow-lan: false
mode: rule
log-level: debug
ipv6: false
external-controller: 127.0.0.1:9090
external-ui: /srv/clash/yacd/
profile:
  store-selected: true

tun:
  enable: true
  stack: gvisor # system gvisor
  auto-route: true
  auto-detect-interface: true
  dns-hijack:
    - 127.0.0.1:53

dns:
  enable: true
  listen: 0.0.0.0:53
  ipv6: false
  default-nameserver:
    - 1.1.1.1
  nameserver:
    - 1.1.1.1
  fallback:
    - 1.1.1.1
  enhanced-mode: redir-host # fake-ip redir-host
  fake-ip-range: 198.18.0.1/16
```

### Clash log

```shell
4月 17 21:14:16 tb14p-debian clash[50026]: time="2022-04-17T21:14:16+08:00" level=info msg="[UDP] 198.18.0.1:39673 --> 192.168.50.1:53 match RuleSet(lancidr) using DIRECT"
4月 17 21:14:16 tb14p-debian clash[50026]: time="2022-04-17T21:14:16+08:00" level=info msg="[TCP] 198.18.0.1:45778 --> 142.251.42.238:80 match Match() using PROXY[XXXXXXXX]"
```

### Description

fake-ip 模式下并且开启tun, 正常来说应该会拦截操作系统的 dns 请求直接返回 fake-ip-range 中的一个 ip, 但是在我的设备上和预期的行为不一致。
从上方的日志可以看出，clash 直接调用了操作系统的 dns 地址进行了解析并返回，后续一条日志中的 `142.251.42.238` 就是解析出来的 ip。这一点从抓包中也可以看出来。

执行 `curl http://google.com -v`
```
*   Trying 142.251.42.238:80...
* Connected to google.com (142.251.42.238) port 80 (#0)
> GET / HTTP/1.1
> Host: google.com
> User-Agent: curl/7.82.0
> Accept: */*
> 
* Mark bundle as not supporting multiuse
< HTTP/1.1 301 Moved Permanently
< Location: http://www.google.com/
< Content-Type: text/html; charset=UTF-8
< Date: Sun, 17 Apr 2022 13:14:16 GMT
< Expires: Tue, 17 May 2022 13:14:16 GMT
< Cache-Control: public, max-age=2592000
< Server: gws
< Content-Length: 219
< X-XSS-Protection: 0
< X-Frame-Options: SAMEORIGIN
< 
<HTML><HEAD><meta http-equiv="content-type" content="text/html;charset=utf-8">
<TITLE>301 Moved</TITLE></HEAD><BODY>
<H1>301 Moved</H1>
The document has moved
<A HREF="http://www.google.com/">here</A>.
</BODY></HTML>
* Connection #0 to host google.com left intact
```
`sudo tcpdump -i utun -n -U`
```
21:14:16.422283 IP 198.18.0.1.39673 > 192.168.50.1.53: 42477+ A? google.com. (28)
21:14:16.422295 IP 198.18.0.1.39673 > 192.168.50.1.53: 20453+ AAAA? google.com. (28)
21:14:16.456732 IP 192.168.50.1.53 > 198.18.0.1.39673: 20453 0/1/0 (78)
21:14:16.456823 IP 192.168.50.1.53 > 198.18.0.1.39673: 42477 1/0/0 A 142.251.42.238 (44)
21:14:16.457295 IP 198.18.0.1.45778 > 142.251.42.238.80: Flags [S], seq 595867789, win 62720, options [mss 8960,sackOK,TS val 3932398600 ecr 0,nop,wscale 7], length 0
21:14:16.457634 IP 142.251.42.238.80 > 198.18.0.1.45778: Flags [S.], seq 176343989, ack 595867790, win 65535, options [mss 8960,sackOK,TS val 2896606613 ecr 3932398600,nop,wscale 0], length 0
21:14:16.457681 IP 198.18.0.1.45778 > 142.251.42.238.80: Flags [.], ack 1, win 490, options [nop,nop,TS val 3932398600 ecr 2896606613], length 0
21:14:16.457845 IP 198.18.0.1.45778 > 142.251.42.238.80: Flags [P.], seq 1:75, ack 1, win 490, options [nop,nop,TS val 3932398600 ecr 2896606613], length 74: HTTP: GET / HTTP/1.1

```
我不确定是我哪儿配置有问题还是设备上有其他的干扰项。这导致的问题是可能存在的 dns 污染，比如 raw.githubusercontent.com 被解析到了 0.0.0.0

clash 使用 systemd 进行管理
```
❯ systemctl cat clash
# /etc/systemd/system/clash.service
[Unit]
Description=A rule based proxy tunnel
After=network-online.target nftables.service iptabels.service

[Service]
Type=simple
LimitNOFILE=65535
ExecStart =/usr/bin/clash -d /srv/clash

[Install]
WantedBy=multi-user.target
```

**Comment by Kr328** [comment]
预期的

192.168.50.1:53 并没有在 dns-hijack

dns-hijack 里的 127.0.0.1:53 并没有任何意义

127.0.0.0/8 会命中路由规则 local 直接在本地网络协议栈处理 并不会发送到 utun

**Comment by moonheart** [comment]
也就是说，tun 会劫持操作系统的 dns 请求， 如果某次请求的 dns 服务器地址在 dns-hijack 列表里面：
     1. 如果 dns 模式是 fake-ip，会返回一个 fake-ip 给操作系统，随后向 fake-ip 建立连接时会去调用 dns 块中的配置解析 ip。
     2. 如果 dns 模式是 redir-host，会直接通过 dns 块中的配置解析 ip。
      
我需要在 dns-hijack  列表中填入操作系统默认的 dns （也就是 192.168.50.1）。

不知道我理解的对不对

**Comment by Dreamacro** [comment]
劫持的前提是流量经过 clash 的 tun，因为 Linux 的 auto-route 实现并不会劫持局域网地址，所以需要你设置随便一个外网的 dns 才能被拦截并且生效

**Comment by Kr328** [comment]
> 劫持的前提是流量经过 clash 的 tun，因为 Linux 的 auto-route 实现并不会劫持局域网地址，所以需要你设置随便一个外网的 dns 才能被拦截并且生效

其实是会的 (

没有进行路由决策的本地 socket 会直接命中 utun 的路由规则

**Comment by moonheart** [comment]
> 劫持的前提是流量经过 clash 的 tun，因为 Linux 的 auto-route 实现并不会劫持局域网地址，所以需要你设置随便一个外网的 dns 才能被拦截并且生效

我把 dns-hijack 设置一个单独的 8.8.8.8，dns 似乎并没有被劫持，nslookup raw.githubusercontent.com 返回的还是被污染的 0.0.0.0

**Comment by Kr328** [comment]
> 也就是说，tun 会劫持操作系统的 dns 请求， 如果某次请求的 dns 服务器地址在 dns-hijack 列表里面： 1. 如果 dns 模式是 fake-ip，会返回一个 fake-ip 给操作系统，随后向 fake-ip 建立连接时会去调用 dns 块中的配置解析 ip。 2. 如果 dns 模式是 redir-host，会直接通过 dns 块中的配置解析 ip。
> 
> 我需要在 dns-hijack 列表中填入操作系统默认的 dns （也就是 192.168.50.1）。
> 
> 不知道我理解的对不对

dns-hijack 只会劫持**进入 tun 设备**的 DNS 包 并且目的 DNS 在 dns-hijack 上才会被劫持

**Comment by moonheart** [comment]
> > 也就是说，tun 会劫持操作系统的 dns 请求， 如果某次请求的 dns 服务器地址在 dns-hijack 列表里面： 1. 如果 dns 模式是 fake-ip，会返回一个 fake-ip 给操作系统，随后向 fake-ip 建立连接时会去调用 dns 块中的配置解析 ip。 2. 如果 dns 模式是 redir-host，会直接通过 dns 块中的配置解析 ip。
> > 
> > 我需要在 dns-hijack 列表中填入操作系统默认的 dns （也就是 192.168.50.1）。
> > 
> > 不知道我理解的对不对
> 
> dns-hijack 只会劫持**进入 tun 设备**的 DNS 包 并且**目的地址**在 dns-hijack 上才会被劫持

理解了，也就是说在不修改操作系统 dns 的情况下（自动获取），我需要在 dns-hijack 里设置多个可能的 dns 地址（公司的，家里的），才能实现 dns 劫持。

**Comment by Kr328** [comment]
> > > 也就是说，tun 会劫持操作系统的 dns 请求， 如果某次请求的 dns 服务器地址在 dns-hijack 列表里面： 1. 如果 dns 模式是 fake-ip，会返回一个 fake-ip 给操作系统，随后向 fake-ip 建立连接时会去调用 dns 块中的配置解析 ip。 2. 如果 dns 模式是 redir-host，会直接通过 dns 块中的配置解析 ip。
> > > 我需要在 dns-hijack 列表中填入操作系统默认的 dns （也就是 192.168.50.1）。
> > > 不知道我理解的对不对
> > 
> > 
> > dns-hijack 只会劫持**进入 tun 设备**的 DNS 包 并且**目的地址**在 dns-hijack 上才会被劫持
> 
> 理解了，也就是说在不修改操作系统 dns 的情况下（自动获取），我需要在 dns-hijack 里设置多个可能的 dns 地址（公司的，家里的），才能实现多个网络环境 dns 劫持。

还可以设置 `udp://any:53` 或者 `udp://0.0.0.0:53`

**Comment by moonheart** [comment]
> 



> > > > 也就是说，tun 会劫持操作系统的 dns 请求， 如果某次请求的 dns 服务器地址在 dns-hijack 列表里面： 1. 如果 dns 模式是 fake-ip，会返回一个 fake-ip 给操作系统，随后向 fake-ip 建立连接时会去调用 dns 块中的配置解析 ip。 2. 如果 dns 模式是 redir-host，会直接通过 dns 块中的配置解析 ip。
> > > > 我需要在 dns-hijack 列表中填入操作系统默认的 dns （也就是 192.168.50.1）。
> > > > 不知道我理解的对不对
> > > 
> > > 
> > > dns-hijack 只会劫持**进入 tun 设备**的 DNS 包 并且**目的地址**在 dns-hijack 上才会被劫持
> > 
> > 
> > 理解了，也就是说在不修改操作系统 dns 的情况下（自动获取），我需要在 dns-hijack 里设置多个可能的 dns 地址（公司的，家里的），才能实现多个网络环境 dns 劫持。
> 
> 还可以设置 `udp://any:53` 或者 `udp://0.0.0.0:53`

感谢你的耐心解答，我的疑问解决了！

**Comment by wheat0r** [comment]
> > > > 也就是说，tun 会劫持操作系统的 dns 请求， 如果某次请求的 dns 服务器地址在 dns-hijack 列表里面： 1. 如果 dns 模式是 fake-ip，会返回一个 fake-ip 给操作系统，随后向 fake-ip 建立连接时会去调用 dns 块中的配置解析 ip。 2. 如果 dns 模式是 redir-host，会直接通过 dns 块中的配置解析 ip。
> > > > 我需要在 dns-hijack 列表中填入操作系统默认的 dns （也就是 192.168.50.1）。
> > > > 不知道我理解的对不对
> > > 
> > > 
> > > dns-hijack 只会劫持**进入 tun 设备**的 DNS 包 并且**目的地址**在 dns-hijack 上才会被劫持
> > 
> > 
> > 理解了，也就是说在不修改操作系统 dns 的情况下（自动获取），我需要在 dns-hijack 里设置多个可能的 dns 地址（公司的，家里的），才能实现多个网络环境 dns 劫持。
> 
> 还可以设置 `udp://any:53` 或者 `udp://0.0.0.0:53`

我可不可以这样理解，对于启用tun，并且在dns中使用redir-host模式的场景，如果dns-hijack掉所有dns请求，那么终端只需要配置任何一个公网DNS地址，请求都会被tun劫持，并且不再需要特别的iptables流量策略？
