### ISSUE TITLE
[Bug] <问题标题>linux旁路由使用clash做网关代理，docker服务在clash运行时无法从公网访问

### ISSUE THREAD

**Issue by ZTG0421** [Dreamacro/clash#2984]
### 先决条件

- [X] 我了解这里是官方开源版 Clash 核心仓库，**只提供开源版或者 Premium 内核的支持**
- [X] 我要提交 Clash 核心的问题，并非 Clash.Meta / OpenClash / ClashX / Clash For Windows 或其他任何衍生版本的问题
- [X] 我使用的是**本仓库**最新版本的 Clash 或 Clash Premium 内核
- [X] 我已经在 [Issue Tracker](……/) 中找过我要提出的 bug，**并且没有找到相关问题**
- [X] 我已经仔细阅读 [官方 Wiki](https://dreamacro.github.io/clash/) 并无法自行解决问题
- [X] （非 Premium 内核必填）我已经使用 dev 分支版本测试过，问题依旧存在

### 版本

任意版本

### 适用的作业系统

Linux

### 适用的硬件架构

amd64

### 配置文件

```YAML
tcpdump 的信息

16:12:01.819588 enp0s25 In  IP 102.74.127.124.broad.bj.bj.static.163data.com.cn.privilege > Zarch.http: Flags [S], seq 193957057, win 65535, options [mss 1380,sackOK,TS val 495714421 ecr 0,nop,wscale 9], length 0
16:12:01.819959 utun  In  IP 102.74.127.124.broad.bj.bj.static.163data.com.cn.privilege > Zarch.http: Flags [R], seq 193957058, win 0, length 0
16:12:01.825599 enp0s25 In  IP 102.74.127.124.broad.bj.bj.static.163data.com.cn.quartus-tcl > Zarch.http: Flags [S], seq 4044630292, win 65535, options [mss 1380,sackOK,TS val 495714423 ecr 0,nop,wscale 9], length 0
16:12:01.826004 utun  In  IP 102.74.127.124.broad.bj.bj.static.163data.com.cn.quartus-tcl > Zarch.http: Flags [R], seq 4044630293, win 0, length 0
16:12:02.035719 enp0s25 In  IP 102.74.127.124.broad.bj.bj.static.163data.com.cn.idotdist > Zarch.http: Flags [S], seq 657069195, win 65535, options [mss 1380,sackOK,TS val 495714638 ecr 0,nop,wscale 9], length 0
16:12:02.035931 utun  In  IP 102.74.127.124.broad.bj.bj.static.163data.com.cn.idotdist > Zarch.http: Flags [R], seq 657069196, win 0, length 0
16:12:02.858545 enp0s25 In  IP 102.74.127.124.broad.bj.bj.static.163data.com.cn.privilege > Zarch.http: Flags [S], seq 193957057, win 65535, options [mss 1380,sackOK,TS val 495715436 ecr 0,nop,wscale 9], length 0
16:12:02.858819 utun  In  IP 102.74.127.124.broad.bj.bj.static.163data.com.cn.privilege > Zarch.http: Flags [R], seq 193957058, win 0, length 0
16:12:02.860084 enp0s25 In  IP 102.74.127.124.broad.bj.bj.static.163data.com.cn.quartus-tcl > Zarch.http: Flags [S], seq 4044630292, win 65535, options [mss 1380,sackOK,TS val 495715436 ecr 0,nop,wscale 9], length 0
16:12:02.860352 utun  In  IP 102.74.127.124.broad.bj.bj.static.163data.com.cn.quartus-tcl > Zarch.http: Flags [R], seq 4044630293, win 0, length 0
16:12:03.060285 enp0s25 In  IP 102.74.127.124.broad.bj.bj.static.163data.com.cn.idotdist > Zarch.http: Flags [S], seq 657069195, win 65535, options [mss 1380,sackOK,TS val 495715656 ecr 0,nop,wscale 9], length 0
16:12:03.060782 utun  In  IP 102.74.127.124.broad.bj.bj.static.163data.com.cn.idotdist > Zarch.http: Flags [R], seq 657069196, win 0, length 0
16:12:04.865156 enp0s25 In  IP 102.74.127.124.broad.bj.bj.static.163data.com.cn.quartus-tcl > Zarch.http: Flags [S], seq 4044630292, win 65535, options [mss 1380,sackOK,TS val 495717449 ecr 0,nop,wscale 9], length 0
16:12:04.865512 utun  In  IP 102.74.127.124.broad.bj.bj.static.163data.com.cn.quartus-tcl > Zarch.http: Flags [R], seq 4044630293, win 0, length 0
16:12:04.873921 enp0s25 In  IP 102.74.127.124.broad.bj.bj.static.163data.com.cn.privilege > Zarch.http: Flags [S], seq 193957057, win 65535, options [mss 1380,sackOK,TS val 495717450 ecr 0,nop,wscale 9], length 0
16:12:04.874340 utun  In  IP 102.74.127.124.broad.bj.bj.static.163data.com.cn.privilege > Zarch.http: Flags [R], seq 193957058, win 0, length 0
16:12:05.080364 enp0s25 In  IP 102.74.127.124.broad.bj.bj.static.163data.com.cn.idotdist > Zarch.http: Flags [S], seq 657069195, win 65535, options [mss 1380,sackOK,TS val 495717676 ecr 0,nop,wscale 9], length 0
16:12:05.080831 utun  In  IP 102.74.127.124.broad.bj.bj.static.163data.com.cn.idotdist > Zarch.http: Flags [R], seq 657069196, win 0, length 0
```

### 问题描述

无法从公网访问本地服务
