### ISSUE TITLE
[Bug] 开启ebpf 跨vlan 不能访问部署clash机器。相同vlan下可以正常访问，clash机器可以访问不同vlan机器

### ISSUE THREAD

**Issue by qist** [Dreamacro/clash#2086]
### Verify steps

- [X]  如果你可以自己 debug 并解决的话，提交 PR 吧 Is this something you can **debug and fix**? Send a pull request! Bug fixes and documentation fixes are welcome. 
- [X]  我已经在 [Issue Tracker](……/) 中找过我要提出的问题 I have searched on the [issue tracker](……/) for a related issue. 
- [X]  我已经使用 dev 分支版本测试过，问题依旧存在 I have tested using the dev branch, and the issue still exists. 
- [X]  我已经仔细看过 [Documentation](https://github.com/Dreamacro/clash/wiki/) 并无法自行解决问题 I have read the [documentation](https://github.com/Dreamacro/clash/wiki/) and was unable to solve the issue. 
- [X]  这是 Clash 核心的问题，并非我所使用的 Clash 衍生版本（如 OpenClash、KoolClash 等）的特定问题 This is an issue of the Clash core *per se*, not to the derivatives of Clash, like OpenClash or KoolClash. 

### Clash version

Clash 2022.04.17 linux amd64

### Clash config

```yaml
mixed-port: 7890
allow-lan: true
mode: rule
log-level: info
external-controller: 0.0.0.0:9090
ipv6: false

dns:
  enable: true
  listen: 0.0.0.0:53
  ipv6: false
  enhanced-mode: redir-host
  fake-ip-range: 198.19.0.1/16
  nameserver:
    - 192.168.2.2:53
    - 192.168.2.3:53
  fallback:
    - 192.168.1.110:53

interface-name: eth0

tun:
  enable: true
  stack: system
  dns-hijack:
    - 192.168.2.2:53
    - 192.168.2.3:53
    - any:53
    - tcp://any:53
  auto-route: true
  auto-detect-interface: true

routing-mark: 7777
ebpf:
  redirect-to-tun:
    - eth0
```

### Clash log

```shell
Apr 19 09:29:28 control-plane.minikube.internal clash-linux-amd64[30088]: time="2022-04-19T09:29:28+08:00" level=info msg="Start initial compatible provider ✈️ 墙外网站"
Apr 19 09:29:28 control-plane.minikube.internal clash-linux-amd64[30088]: time="2022-04-19T09:29:28+08:00" level=info msg="Start initial compatible provider <U+1F6AB> 以下不用动"
Apr 19 09:29:28 control-plane.minikube.internal clash-linux-amd64[30088]: time="2022-04-19T09:29:28+08:00" level=info msg="Start initial compatible provider <U+1F3A5> NETFLIX"
Apr 19 09:29:28 control-plane.minikube.internal clash-linux-amd64[30088]: time="2022-04-19T09:29:28+08:00" level=info msg="Start initial compatible provider <U+1F30D> 国外媒体"
Apr 19 09:29:28 control-plane.minikube.internal clash-linux-amd64[30088]: time="2022-04-19T09:29:28+08:00" level=info msg="Start initial compatible provider Ⓜ️ 微软苹果"
Apr 19 09:29:28 control-plane.minikube.internal clash-linux-amd64[30088]: time="2022-04-19T09:29:28+08:00" level=info msg="Start initial compatible provider <U+1F41F> 其他网站"
Apr 19 09:29:28 control-plane.minikube.internal clash-linux-amd64[30088]: time="2022-04-19T09:29:28+08:00" level=info msg="Start initial rule provider Netflix"
Apr 19 09:29:28 control-plane.minikube.internal clash-linux-amd64[30088]: time="2022-04-19T09:29:28+08:00" level=info msg="Start initial rule provider Proxy"
Apr 19 09:29:28 control-plane.minikube.internal clash-linux-amd64[30088]: time="2022-04-19T09:29:28+08:00" level=info msg="Start initial rule provider ITdev"
Apr 19 09:29:28 control-plane.minikube.internal clash-linux-amd64[30088]: time="2022-04-19T09:29:28+08:00" level=info msg="Start initial rule provider Chinao"
Apr 19 09:29:28 control-plane.minikube.internal clash-linux-amd64[30088]: time="2022-04-19T09:29:28+08:00" level=info msg="Start initial rule provider Chinat"
Apr 19 09:29:28 control-plane.minikube.internal clash-linux-amd64[30088]: time="2022-04-19T09:29:28+08:00" level=info msg="Start initial rule provider Chinas"
Apr 19 09:29:28 control-plane.minikube.internal clash-linux-amd64[30088]: time="2022-04-19T09:29:28+08:00" level=info msg="Start initial rule provider Apple"
Apr 19 09:29:28 control-plane.minikube.internal clash-linux-amd64[30088]: time="2022-04-19T09:29:28+08:00" level=info msg="Start initial rule provider IpDirect"
Apr 19 09:29:28 control-plane.minikube.internal clash-linux-amd64[30088]: time="2022-04-19T09:29:28+08:00" level=info msg="Start initial rule provider Foreignmedia"
Apr 19 09:29:28 control-plane.minikube.internal clash-linux-amd64[30088]: time="2022-04-19T09:29:28+08:00" level=info msg="DNS server listening at: [::]:53"
Apr 19 09:29:28 control-plane.minikube.internal clash-linux-amd64[30088]: time="2022-04-19T09:29:28+08:00" level=info msg="RESTful API listening at: [::]:9090"
Apr 19 09:29:28 control-plane.minikube.internal clash-linux-amd64[30088]: time="2022-04-19T09:29:28+08:00" level=info msg="Mixed(http+socks) proxy listening at: [::]:7890"
Apr 19 09:29:28 control-plane.minikube.internal clash-linux-amd64[30088]: time="2022-04-19T09:29:28+08:00" level=info msg="Tun Proxy listening at: utun(198.19.0.1)"
Apr 19 09:31:19 control-plane.minikube.internal clash-linux-amd64[30088]: time="2022-04-19T09:31:19+08:00" level=info msg="[UDP] 198.19.0.1:46229 --> 185.209.85.222:123 match GeoIP(RU) using ✈️ 墙外网站[mobile]"
Apr 19 09:36:29 control-plane.minikube.internal clash-linux-amd64[30088]: time="2022-04-19T09:36:29+08:00" level=info msg="[TCP] 198.19.0.1:42096 --> 192.168.1.110:22 match RuleSet(IpDirect) using DIRECT"
Apr 19 09:37:17 control-plane.minikube.internal clash-linux-amd64[30088]: time="2022-04-19T09:37:17+08:00" level=info msg="[UDP] 198.19.0.1:59482 --> 193.182.111.143:123 match Match() using <U+1F41F> 其他网站[DI
Apr 19 09:40:16 control-plane.minikube.internal clash-linux-amd64[30088]: time="2022-04-19T09:40:16+08:00" level=info msg="[UDP] 198.19.0.1:45342 --> 5.79.108.34:123 match GeoIP(NL) using ✈️ 墙外网站[mobile]"
```

### Description

开启 ebpf 跨网段不能ssh  到部署clash机器，相同子网可以，跨vlan 不可以。clash机器 可以ssh 跨vlan 机器。

```
[root@control-plane clash]# ssh 192.168.1.110
root@192.168.1.110's password:
正常
[root@ipnetwork ~]# ssh 192.168.2.186

不正常
[root@ipnetwork ~]#  traceroute 192.168.2.186
traceroute to 192.168.2.186 (192.168.2.186), 30 hops max, 60 byte packets
 1  192.168.0.2 (192.168.0.2)  0.204 ms  0.181 ms  0.148 ms
只能到网关
```
关闭ebpf  正常

**Comment by Dreamacro** [comment]
`auto-route` 和 `redirect-to-tun` 不要混着用，只开其中一个呢

**Comment by qist** [comment]
好的，我试试。

**Comment by qist** [comment]
```
tun:
  enable: true
  stack: system
  dns-hijack:
    - 192.168.2.84:53
    - 192.168.2.89:53
    - any:53
    - tcp://any:53
#  auto-route: true
  auto-detect-interface: true

routing-mark: 7777
ebpf:
  redirect-to-tun:
    - eth0
```
```
root@Qist ~# ssh 192.168.2.186

kex_exchange_identification: Connection closed by remote host
Connection closed by 192.168.2.186 port 22
```
结果一样的。
不用redirect-to-tun 使用auto-route 正常的

**Comment by Dreamacro** [comment]
能描述一下网卡的网段，和你网络的网段么

**Comment by qist** [comment]
```
# clash 网段： 198.19.0.1/16
# clash  服务器网段：192.168.2.0/23 网关：192.168.2.2
# 工作网段：192.168.0.0/23  网关：192.168.0.2
# 工作网段不能访问clash服务器 。clash 服务器可以访问工作网段。 
```

**Comment by qist** [comment]
[root@control-plane clash]# tcpdump -i eth0 'port 22 and host 192.168.0.151' -vv
tcpdump: listening on eth0, link-type EN10MB (Ethernet), capture size 262144 bytes
11:29:33.301204 IP (tos 0x0, ttl 63, id 6192, offset 0, flags [DF], proto TCP (6), length 52)
    192.168.0.151.11763 > control-plane.minikube.internal.ssh: Flags [S], cksum 0xaf4d (correct), seq 1690545607, win 64240, options [mss 1360,nop,wscale 8,nop,nop,sackOK], length 0
11:29:34.311798 IP (tos 0x0, ttl 63, id 6193, offset 0, flags [DF], proto TCP (6), length 52)
    192.168.0.151.11763 > control-plane.minikube.internal.ssh: Flags [S], cksum 0xaf4d (correct), seq 1690545607, win 64240, options [mss 1360,nop,wscale 8,nop,nop,sackOK], length 0
11:29:36.322589 IP (tos 0x0, ttl 63, id 6194, offset 0, flags [DF], proto TCP (6), length 52)
    192.168.0.151.11763 > control-plane.minikube.internal.ssh: Flags [S], cksum 0xaf4d (correct), seq 1690545607, win 64240, options [mss 1360,nop,wscale 8,nop,nop,sackOK], length 0

[root@control-plane clash]# tcpdump -i utun  -vv
tcpdump: listening on utun, link-type RAW (Raw IP), capture size 262144 bytes
11:27:23.352582 IP (tos 0x0, ttl 64, id 0, offset 0, flags [DF], proto TCP (6), length 52)
    control-plane.minikube.internal.ssh > 192.168.0.151.11643: Flags [S.], cksum 0x6de5 (correct), seq 2527198925, ack 294758374, win 65535, options [mss 1460,nop,nop,sackOK,nop,wscale 9], length 0
11:27:23.352885 IP (tos 0x0, ttl 64, id 0, offset 0, flags [DF], proto TCP (6), length 52)
    198.19.0.2.ssh > control-plane.minikube.internal.cbt: Flags [S.], cksum 0x7577 (correct), seq 2527198925, ack 294758374, win 65535, options [mss 1460,nop,nop,sackOK,nop,wscale 9], length 0
11:27:23.352918 IP (tos 0x0, ttl 64, id 0, offset 0, flags [DF], proto TCP (6), length 40)
    control-plane.minikube.internal.cbt > 198.19.0.2.ssh: Flags [R], cksum 0x4bc8 (correct), seq 294758374, win 0, length 0
11:27:23.352944 IP (tos 0x0, ttl 64, id 0, offset 0, flags [DF], proto TCP (6), length 40)
    192.168.0.151.11643 > control-plane.minikube.internal.ssh: Flags [R], cksum 0x4436 (correct), seq 294758374, win 0, length 0
11:27:24.365447 IP (tos 0x0, ttl 64, id 0, offset 0, flags [DF], proto TCP (6), length 52)
    control-plane.minikube.internal.ssh > 192.168.0.151.11643: Flags [S.], cksum 0xefc4 (correct), seq 2543025148, ack 294758374, win 65535, options [mss 1460,nop,nop,sackOK,nop,wscale 9], length 0
11:27:24.365610 IP (tos 0x0, ttl 64, id 0, offset 0, flags [DF], proto TCP (6), length 52)
    198.19.0.2.ssh > control-plane.minikube.internal.cbt: Flags [S.], cksum 0xf756 (correct), seq 2543025148, ack 294758374, win 65535, options [mss 1460,nop,nop,sackOK,nop,wscale 9], length 0
11:27:24.365636 IP (tos 0x0, ttl 64, id 0, offset 0, flags [DF], proto TCP (6), length 40)
    control-plane.minikube.internal.cbt > 198.19.0.2.ssh: Flags [R], cksum 0x4bc8 (correct), seq 294758374, win 0, length 0
11:27:24.365661 IP (tos 0x0, ttl 64, id 0, offset 0, flags [DF], proto TCP (6), length 40)
    192.168.0.151.11643 > control-plane.minikube.internal.ssh: Flags [R], cksum 0x4436 (correct), seq 294758374, win 0, length 0
11:27:26.372319 IP (tos 0x0, ttl 64, id 0, offset 0, flags [DF], proto TCP (6), length 52)
    control-plane.minikube.internal.ssh > 192.168.0.151.11643: Flags [S.], cksum 0x73e9 (correct), seq 2574382585, ack 294758374, win 65535, options [mss 1460,nop,nop,sackOK,nop,wscale 9], length 0
11:27:26.372507 IP (tos 0x0, ttl 64, id 0, offset 0, flags [DF], proto TCP (6), length 52)
    198.19.0.2.ssh > control-plane.minikube.internal.cbt: Flags [S.], cksum 0x7b7b (correct), seq 2574382585, ack 294758374, win 65535, options [mss 1460,nop,nop,sackOK,nop,wscale 9], length 0
11:27:26.372540 IP (tos 0x0, ttl 64, id 0, offset 0, flags [DF], proto TCP (6), length 40)
    control-plane.minikube.internal.cbt > 198.19.0.2.ssh: Flags [R], cksum 0x4bc8 (correct), seq 294758374, win 0, length 0
11:27:26.372565 IP (tos 0x0, ttl 64, id 0, offset 0, flags [DF], proto TCP (6), length 40)
    192.168.0.151.11643 > control-plane.minikube.internal.ssh: Flags [R], cksum 0x4436 (correct), seq 294758374, win 0, length 0
