### ISSUE TITLE
[Bug] 概率性DNS解析失败

### ISSUE THREAD

**Issue by Ex-Origin** [Dreamacro/clash#2968]
### 先决条件

- [X] 我了解这里是官方开源版 Clash 核心仓库，**只提供开源版或者 Premium 内核的支持**
- [X] 我要提交 Clash 核心的问题，并非 Clash.Meta / OpenClash / ClashX / Clash For Windows 或其他任何衍生版本的问题
- [X] 我使用的是**本仓库**最新版本的 Clash 或 Clash Premium 内核
- [X] 我已经在 [Issue Tracker](……/) 中找过我要提出的 bug，**并且没有找到相关问题**
- [X] 我已经仔细阅读 [官方 Wiki](https://dreamacro.github.io/clash/) 并无法自行解决问题
- [X] （非 Premium 内核必填）我已经使用 dev 分支版本测试过，问题依旧存在

### 版本

Clash 2023.07.22 linux amd64 with go1.20.6 Sat Jul 22 09:42:37 UTC 2023

### 适用的作业系统

Linux

### 适用的硬件架构

amd64

### 配置文件

```YAML
tun:
    enable: true
    stack: system # or gvisor
    auto-route: false # auto set global route
    auto-detect-interface: false # conflict with interface-name
    dns-hijack:
        - any:53
mode: rule
log-level: debug
external-controller: '127.0.0.1:9090'
ipv6: true
dns:
    enable: true
    ipv6: true
    default-nameserver: [223.5.5.5, 119.29.29.29]
    enhanced-mode: fake-ip
    fake-ip-range: 10.214.0.1/16
    use-hosts: true
    nameserver: ['https://223.5.5.5/dns-query#br0', 'https://223.5.5.5/dns-query#enp0s31f6', 'https://223.5.5.5/dns-query#wlp0s20f3']
```

### 日志输出

```Text
[2023-10-18 22:18:06][DEBUG] [TUN] hijack udp dns addr=223.5.5.5:53
[2023-10-18 22:18:06][DEBUG] [TUN] hijack udp dns addr=223.5.5.5:53
[2023-10-18 22:18:06][DEBUG] [TUN] hijack udp dns addr=223.5.5.5:53
[2023-10-18 22:18:14][DEBUG] [TUN] hijack udp dns addr=223.5.5.5:53
[2023-10-18 22:18:29][DEBUG] [TUN] hijack udp dns addr=223.5.5.5:53
[2023-10-18 22:18:29][DEBUG] [TUN] hijack udp dns addr=223.5.5.5:53
[2023-10-18 22:18:29][DEBUG] [TCP] accept connection lAddr=10.214.0.1:58498 rAddr=www.baidu.com:443 inbound=TUN
[2023-10-18 22:18:34][DEBUG] [Matcher] resolve failed error=couldn't find ip host=www.baidu.com
[2023-10-18 22:18:34][DEBUG] [TUN] hijack udp dns addr=223.5.5.5:53
[2023-10-18 22:18:34][DEBUG] [TUN] hijack udp dns addr=1.1.1.1:53
[2023-10-18 22:18:34][DEBUG] [TUN] hijack udp dns addr=1.1.1.1:53
[2023-10-18 22:18:34][DEBUG] [TCP] accept connection lAddr=10.214.0.1:34548 rAddr=dnspod.tencentcloudapi.com:443 inbound=TUN
[2023-10-18 22:18:34][DEBUG] [Matcher] resolve success host=dnspod.tencentcloudapi.com ip=42.194.253.74
[2023-10-18 22:18:34][INFO] [TCP] connected lAddr=10.214.0.1:34548 rAddr=dnspod.tencentcloudapi.com:443 mode=rule rule=GeoIP(CN) proxy=🎯 全球直连[DIRECT]
[2023-10-18 22:18:37][DEBUG] [TUN] hijack udp dns addr=223.5.5.5:53
[2023-10-18 22:18:39][WARN] [TCP] dial failed error=all DNS requests failed, first error: Post "https://223.5.5.5/dns-query": dial tcp4 223.5.5.5:443: i/o timeout proxy=🎯 全球直连 lAddr=10.214.0.1:58498 rAddr=www.baidu.com:443 rule=DomainSuffix rulePayload=baidu.com
```

### 问题描述

很早之前的版本就遇到过这个问题，总是隔几天断网断几十分钟，然后又自己恢复正常了。之前一直没保存环境，这次保存下来了。

```shell
$ sudo tcpdump -n -i any host 223.5.5.5
tcpdump: data link type LINUX_SLL2
tcpdump: verbose output suppressed, use -v[v]... for full protocol decode
listening on any, link-type LINUX_SLL2 (Linux cooked v2), snapshot length 262144 bytes
22:17:29.848497 enp0s31f6 Out ARP, Request who-has 223.5.5.5 tell 192.168.3.151, length 28
22:17:29.936551 wlp0s20f3 B   ARP, Request who-has 223.5.5.5 tell 192.168.3.151, length 46
22:17:30.872445 enp0s31f6 Out ARP, Request who-has 223.5.5.5 tell 192.168.3.151, length 28
22:17:30.960522 wlp0s20f3 B   ARP, Request who-has 223.5.5.5 tell 192.168.3.151, length 46
22:17:31.896462 enp0s31f6 Out ARP, Request who-has 223.5.5.5 tell 192.168.3.151, length 28
22:17:31.986762 wlp0s20f3 B   ARP, Request who-has 223.5.5.5 tell 192.168.3.151, length 46
^C
6 packets captured
6 packets received by filter
0 packets dropped by kernel
```

看了clash日志，原来DNS解析异常了，然后tcpdump抓包看了下，不知道为什么，clash在ARP请求223.5.5.5的地址，很迷惑的行为。希望作者修复一下这个漏洞，虽然很小概率会碰到这种问题，但是碰到了就很难受。

### 复现步骤

日常使用时几率性触发，不太好复现。

**Comment by Ex-Origin** [comment]
补充一下，出现这个问题的时候，223.5.5.5 是可以访问的，直接执行 `curl -v https://223.5.5.5/dns-query` 是可以返回内容的。

**Comment by Ex-Origin** [comment]
今天又出现这种情况了，下面是用tcpdump抓取的相关日志，因为clash日志和之前一样，所以就不贴了。

```
21:18:56.829747 lo    In  IP 192.168.149.183 > 192.168.149.183: ICMP host 223.5.5.5 unreachable, length 68
21:18:56.829774 lo    In  IP 192.168.149.183 > 192.168.149.183: ICMP host 223.5.5.5 unreachable, length 68
21:18:56.829779 lo    In  IP 192.168.149.183 > 192.168.149.183: ICMP host 223.5.5.5 unreachable, length 68
21:18:56.829782 lo    In  IP 192.168.149.183 > 192.168.149.183: ICMP host 223.5.5.5 unreachable, length 68
21:18:56.829783 lo    In  IP 192.168.149.183 > 192.168.149.183: ICMP host 223.5.5.5 unreachable, length 68
21:18:56.829787 lo    In  IP 192.168.149.183 > 192.168.149.183: ICMP host 223.5.5.5 unreachable, length 68
21:18:56.829813 lo    In  IP 192.168.149.183 > 192.168.149.183: ICMP host 223.5.5.5 unreachable, length 68
21:18:56.829817 lo    In  IP 192.168.149.183 > 192.168.149.183: ICMP host 223.5.5.5 unreachable, length 68
21:18:56.829822 lo    In  IP 192.168.149.183 > 192.168.149.183: ICMP host 223.5.5.5 unreachable, length 68
21:18:56.829826 lo    In  IP 192.168.149.183 > 192.168.149.183: ICMP host 223.5.5.5 unreachable, length 68
21:18:56.829831 lo    In  IP 192.168.149.183 > 192.168.149.183: ICMP host 223.5.5.5 unreachable, length 68
21:18:56.923362 utun  Out IP 10.214.0.1.52282 > 10.214.0.34.8080: Flags [P.], seq 15666378:15666430, ack 176569065, win 443, options [nop,nop,TS val 1530748337 ecr 1378021563], length 52: HTTP
21:18:56.923599 utun  In  IP 10.214.0.3.52282 > 10.214.0.1.7777: Flags [P.], seq 15666378:15666430, ack 176569065, win 443, options [nop,nop,TS val 1530748337 ecr 1378021563], length 52
```
