### ISSUE TITLE
About Usage of DNS Server 

### ISSUE THREAD

**Issue by CodeEagle** [Dreamacro/clash#123]
Hi @Dreamacro ,

I'm running clash on a Raspberry Pi(10.0.0.6), with dns enhanced-mode. 

### I failed to open google.com from chrome when I config my dns on mac  to 10.0.0.6.

Any Help? Thanks.

using `dig` form 10.0.0.2 

```shell
~ dig +trace @10.0.0.6 pixv.net

; <<>> DiG 9.10.6 <<>> +trace @10.0.0.6 pixv.net
; (1 server found)
;; global options: +cmd
.			429862	IN	NS	e.root-servers.net.
.			429862	IN	NS	j.root-servers.net.
.			429862	IN	NS	f.root-servers.net.
.			429862	IN	NS	g.root-servers.net.
.			429862	IN	NS	k.root-servers.net.
.			429862	IN	NS	h.root-servers.net.
.			429862	IN	NS	l.root-servers.net.
.			429862	IN	NS	d.root-servers.net.
.			429862	IN	NS	a.root-servers.net.
.			429862	IN	NS	b.root-servers.net.
.			429862	IN	NS	m.root-servers.net.
.			429862	IN	NS	i.root-servers.net.
.			429862	IN	NS	c.root-servers.net.
;; Received 431 bytes from 10.0.0.6#53(10.0.0.6) in 51 ms

net.			172800	IN	NS	a.gtld-servers.net.
net.			172800	IN	NS	b.gtld-servers.net.
net.			172800	IN	NS	c.gtld-servers.net.
net.			172800	IN	NS	d.gtld-servers.net.
net.			172800	IN	NS	e.gtld-servers.net.
net.			172800	IN	NS	f.gtld-servers.net.
net.			172800	IN	NS	g.gtld-servers.net.
net.			172800	IN	NS	h.gtld-servers.net.
net.			172800	IN	NS	i.gtld-servers.net.
net.			172800	IN	NS	j.gtld-servers.net.
net.			172800	IN	NS	k.gtld-servers.net.
net.			172800	IN	NS	l.gtld-servers.net.
net.			172800	IN	NS	m.gtld-servers.net.
net.			86400	IN	DS	35886 8 2 7862B27F5F516EBE19680444D4CE5E762981931842C465F00236401D 8BD973EE
net.			86400	IN	RRSIG	DS 8 1 86400 20190308050000 20190223040000 16749 . RyRSLbnSJrGsHxlJPweQXB+l5KXTaC2QBmHm8e08oDgVkztcJZTkCMzz YF2Jw12xghxA5idWvkPoYbt3n2bOXLVB0VVZCElWN6UhidR3T4L3qMVy okBz+IrZI+8jYgLbc5psY+a+Mzibtp4zUIKKgXJU0vicGD4xtcNdC4Ts MQmA4XSsgMKHNe2WnHFBoDBbO+rjYRJh39hg5uErdojOWL9ij8LiATYK HaSqRPWtMPSdNsH+7JiwjCj6yTIgsjOmCal1rMAMzOOtSD5uQV0S+cRE Q5mrW4Y8pInO3BolXAP9NYyOXb8CdYB3Ajuect+3JkbXdHeBNJb4zwl9 xtyAeQ==
;; Received 1165 bytes from 198.97.190.53#53(h.root-servers.net) in 227 ms

pixv.net.		172800	IN	NS	ns1.xta.net.
pixv.net.		172800	IN	NS	ns2.xta.net.
A1RT98BS5QGC9NFI51S9HCI47ULJG6JH.net. 86400 IN NSEC3 1 1 0 - A1RUUFFJKCT2Q54P78F8EJGJ8JBK7I8B  NS SOA RRSIG DNSKEY NSEC3PARAM
A1RT98BS5QGC9NFI51S9HCI47ULJG6JH.net. 86400 IN RRSIG NSEC3 8 2 86400 20190228064058 20190221053058 51638 net. RUJHlo8mOxoZvVjhAh43fhYZ6Mmbiq04fZh+QgsLfjrbaaQJzBP97TYM AJzs/XwLdj96wsf/ZRFjTjfpccVgq84eB6IrwKKl+R3c5ciFni3LEi5i 7oJYl76QqAYGV8SxZ6QNykzctHE/VpPgKqLmiLLHxxn+XGoksdFMvBiT VD0=
7AR02M8U58J7IEFU0HBGFKIJL0TO4PFU.net. 86400 IN NSEC3 1 1 0 - 7AR56TEIJ84L2EA6OUI25GFQSI4V8NPR  NS DS RRSIG
7AR02M8U58J7IEFU0HBGFKIJL0TO4PFU.net. 86400 IN RRSIG NSEC3 8 2 86400 20190301063632 20190222052632 51638 net. oYuUeHzyTixmAJSD6IFXIHU9Atd8FwoUdhWe0mPJizhrVc9kJG0mEEwp O5JRrOJ90206Jf8ZK1mChtzKooZmPu86YDBhE5wz5OddaLkXvZ2E/Q+3 aPpijE8S8ejW8J3rc3tpUz7qkXGXsWIxV5hh1ggHtbKhwEIIJ33eK5PZ y4I=
couldn't get address for 'ns1.xta.net': not found
couldn't get address for 'ns2.xta.net': not found
dig: couldn't get address for 'ns1.xta.net': no more
```

tcpdum logs 
```shell
17:35:53.185451 IP 10.0.0.2.65300 > 10.0.0.6.domain: 32216+ [1au] A? pixv.net. (37)
17:35:53.186467 IP 10.0.0.6.49608 > dns-a.pdomo.me.domain: 32216+ [1au] A? pixv.net. (37)
17:35:53.186493 IP 10.0.0.6.47162 > 119.29.29.29.domain: 32216+ [1au] A? pixv.net. (37)
17:35:53.186503 IP 10.0.0.6.47342 > public1.alidns.com.domain: 32216+ [1au] A? pixv.net. (37)
17:35:53.186759 IP 10.0.0.6.48119 > public1.114dns.com.domain: 32216+ [1au] A? pixv.net. (37)
17:35:53.186873 IP 10.0.0.6.41740 > google-public-dns-a.google.com.domain: 32216+ [1au] A? pixv.net. (37)
17:35:53.188609 IP 10.0.0.6.46012 > public1.alidns.com.domain: 51493+ PTR? 2.0.0.10.in-addr.arpa. (39)
17:35:53.230877 IP 10.0.0.6.39392 > public1.114dns.com.domain: 13435+ PTR? 29.29.29.119.in-addr.arpa. (43)
17:35:53.230902 IP 10.0.0.6.50685 > public1.alidns.com.domain: 13435+ PTR? 29.29.29.119.in-addr.arpa. (43)
17:35:53.492562 IP 10.0.0.6.44031 > 119.29.29.29.domain: 31609+ PTR? 5.5.5.223.in-addr.arpa. (40)
17:35:53.512802 IP 10.0.0.6.40173 > public1.alidns.com.domain: 45367+ PTR? 114.114.114.114.in-addr.arpa. (46)
17:35:53.525239 IP 119.29.29.29.domain > 10.0.0.6.47406: 45367 1/0/0 PTR public1.114dns.com. (78)
17:35:53.534456 IP public1.114dns.com.domain > 10.0.0.6.36976: 45367 1/0/0 PTR public1.114dns.com. (78)
17:35:53.622537 IP google-public-dns-a.google.com.domain > 10.0.0.6.34387: 31609 1/0/0 PTR public1.alidns.com. (72)
17:35:53.643167 IP google-public-dns-a.google.com.domain > 10.0.0.6.35609: 45367 1/0/0 PTR public1.114dns.com. (78)
17:35:54.186443 IP 10.0.0.6.domain > 10.0.0.2.65300: 32216 ServFail- 0/0/0 (26)
17:35:54.948304 IP public1.alidns.com.domain > 10.0.0.6.47342: 32216 ServFail 0/0/0 (26)
17:35:55.660474 IP 119.29.29.29.domain > 10.0.0.6.47162: 32216 ServFail 0/0/1 (37)
17:35:57.881573 IP google-public-dns-a.google.com.domain > 10.0.0.6.41740: 32216 ServFail 0/0/1 (37)
17:36:03.211839 IP public1.114dns.com.domain > 10.0.0.6.48119: 32216 ServFail 0/0/0 (26)
```

config is below.
```yaml
allow-lan: true
external-controller: 127.0.0.1:9090
log-level: debug
mode: Rule
port: 7890
socks-port: 7891
redir-port: 7892
dns:
  enable: true # set true to enable dns (default is false)
  ipv6: false # default is false
  listen: 0.0.0.0:53
  enhanced-mode: redir-host
  nameserver:
    - 8.8.8.8
    - 119.29.29.29
    - 223.5.5.5
    - 114.114.114.114
  fallback:
    - 101.132.183.99
```

clash log
```shell

time="2019-02-23T17:35:53+08:00" level=debug msg="[DNS] answer length is zero: &dns.Msg{MsgHdr:dns.MsgHdr{Id:0xc925, Response:true, Opcode:0, Authoritative:false, Truncated:false, RecursionDesired:true, RecursionAvailable:true, Zero:false, AuthenticatedData:false, CheckingDisabled:false, Rcode:0}, Compress:false, Question:[]dns.Question{dns.Question{Name:\"2.0.0.10.in-addr.arpa.\", Qtype:0xc, Qclass:0x1}}, Answer:[]dns.RR(nil), Ns:[]dns.RR(nil), Extra:[]dns.RR(nil)}"
time="2019-02-23T17:35:53+08:00" level=debug msg="[DNS] msg to ip error: Can't parse msg"
time="2019-02-23T17:35:53+08:00" level=debug msg="[DNS] answer length is zero: &dns.Msg{MsgHdr:dns.MsgHdr{Id:0xa2d1, Response:true, Opcode:0, Authoritative:false, Truncated:false, RecursionDesired:true, RecursionAvailable:true, Zero:false, AuthenticatedData:false, CheckingDisabled:false, Rcode:0}, Compress:false, Question:[]dns.Question{dns.Question{Name:\"6.0.0.10.in-addr.arpa.\", Qtype:0xc, Qclass:0x1}}, Answer:[]dns.RR(nil), Ns:[]dns.RR(nil), Extra:[]dns.RR(nil)}"
time="2019-02-23T17:35:53+08:00" level=debug msg="[DNS] msg to ip error: Can't parse msg"
time="2019-02-23T17:35:53+08:00" level=debug msg="[DNS] msg to ip error: Can't parse msg"
time="2019-02-23T17:35:53+08:00" level=debug msg="[DNS] msg to ip error: Can't parse msg"
```

**Comment by Dreamacro** [comment]
Are you sure you want to dig `pixv.net` instead of `pixiv.net`?

**Comment by CodeEagle** [comment]
Sorry, my bad, 

dig with it is success, but set dns with 10.0.0.6, open it with chrome  still the same.

![image](https://user-images.githubusercontent.com/2311352/53288379-eadbcd00-37c1-11e9-997d-70e01cd5fb03.png)


```shell 
~ dig +trace @10.0.0.6 pixiv.net

; <<>> DiG 9.10.6 <<>> +trace @10.0.0.6 pixiv.net
; (1 server found)
;; global options: +cmd
.			210056	IN	NS	d.root-servers.net.
.			210056	IN	NS	l.root-servers.net.
.			210056	IN	NS	b.root-servers.net.
.			210056	IN	NS	i.root-servers.net.
.			210056	IN	NS	c.root-servers.net.
.			210056	IN	NS	j.root-servers.net.
.			210056	IN	NS	h.root-servers.net.
.			210056	IN	NS	a.root-servers.net.
.			210056	IN	NS	k.root-servers.net.
.			210056	IN	NS	e.root-servers.net.
.			210056	IN	NS	g.root-servers.net.
.			210056	IN	NS	f.root-servers.net.
.			210056	IN	NS	m.root-servers.net.
;; Received 420 bytes from 10.0.0.6#53(10.0.0.6) in 44 ms

pixiv.net.		114	IN	A	66.220.158.32
;; Received 43 bytes from 199.9.14.201#53(b.root-servers.net) in 5 ms
```

clash log
```shell
time="2019-02-23T23:20:06+08:00" level=debug msg="[DNS] answer length is zero: &dns.Msg{MsgHdr:dns.MsgHdr{Id:0xe42f, Response:true, Opcode:0, Authoritative:false, Truncated:false, RecursionDesired:true, RecursionAvailable:true, Zero:false, AuthenticatedData:false, CheckingDisabled:false, Rcode:0}, Compress:false, Question:[]dns.Question{dns.Question{Name:\"2.0.0.10.in-addr.arpa.\", Qtype:0xc, Qclass:0x1}}, Answer:[]dns.RR(nil), Ns:[]dns.RR(nil), Extra:[]dns.RR(nil)}"
time="2019-02-23T23:20:06+08:00" level=debug msg="[DNS] msg to ip error: Can't parse msg"
```

**Comment by Dreamacro** [comment]
Coincidentally, I also tested Raspberry Pi as a transparent proxy today. With wlan ap mode, it works well in my mbp today. Is this problem accidental or inevitable? the DNS server seems to work normally.

**Comment by CodeEagle** [comment]
Hi @Dreamacro ,
My Raspberry Pi is just disabling system-resolve which will occupying port 53 and run clash, without any `iptables` rules or `dnsmasp` setting. 

Am I using it the right way?

![image](https://user-images.githubusercontent.com/2311352/53293863-22289900-3817-11e9-8b5e-a129066b325f.png)

**Comment by Dreamacro** [comment]
The `enhanced-mode` usually cooperates with `redir`. `redir` mode only received ip and dns server provides the mapping for the clash,  clash use ip to lookup domain then pass through it to rule matcher.

**Comment by CodeEagle** [comment]
@Dreamacro you mean that need set all the request redirect to redir-port in iptables?
port 53/80/443 ?

**Comment by Dreamacro** [comment]
yep, 80/443 for tcp, 53 for udp

**Comment by CodeEagle** [comment]
@Dreamacro Thanks

**Comment by Dreamacro** [comment]
If you have any other questions, you can reopen this issue.
